Word,Hiragana,Example Sentence 1,Example Sentence 2,English Translation
就いて ,ついて,不動産の仕事に就いて20年。,仕事を始める。また、物事が決まる。,N/A
相談 ,そうだん,仕事柄、「マンションを買いたいが、いつが買い時か」という相談をよく受けます。,悩むことを他人に言ったり意見を尋ねたりすること。,相談すること
住みたい ,すみたい,仕事が安定して、予算や住みたい町、希望の間取りなどについて考えがまとまったなら、特に購入時期を迷う必要はないでしょう。,希望通りにそう暮らしたいと思う。,住みたい町がある。
市場 ,しじょう,市場でいう買い時よりも、自分自身のタイミングを重視した人のほうが、たいていは満足のいく買い物ができるようです。,商品や投資、技術などの提供・需要が発生する場所。,市場で買い物をする。
供給 ,きょうきゅう,マンションの供給が多い時期は、誰でも住みたくなるような物件を比較的安く買えるので、好機といえます。,需要に対して提供すること。,食料の供給が途絶える。
比較的 ,ひかくてき,マンションの供給が多い時期は,,
